Category,Text
3,what is the name of the dmx song in grand theft auto liberty city stories?
4,would you leave your boyfriend of 15 years for a better job that in in a diffrent state?
7,wat is the answer to (5x - 2 ) ( 4x + 3 )?
1,why is it that you can help so many people unselfishly
5,how can i check my final grades for college?
6,im losing my voice? how can i get my voice back quick??
6,pain relief for pain in the ball of foot?
4,how do i get all of the girls in my school to love me? like steps or something
6,how can i find someone  in indiana or ohio who performs cool laser therapy? there is a holistic clinic in vail colorado that offers cool therapy laser treatments. how can i find someone in indiana or ohio who does the same treatments? i've tried everything i can think of via internet directories
3,where can i learn to do the robot?
1,who would win in a fight godzilla or king kong and why?
4,i'd like a 15-16 year old guy's opinion on this one...? ok so i really like this guy at school alot..and i have for about 3 years now.  i really think he likes but i'm not really sure.  he's really shy and nice and super funny.  i don't know what to do.  if a girl liked you and they told you
2,best bit torrent client? im currently using shareaza to download torrents. do u think there is a better client to do that?&#xa;&#xa;thx guys!
6,do girls fart
3,why have i started watching south park 
4,how can i stop cummuing quick with my girl friend?
1,iam a adult baby how can i tell my wife?
5,what was president wilson's opinion of wwi at the beginning of the war? did most americans agree with him?
2,what do you think of my website? (www.solutionbound.com) any comments or suggestions including the ads?
2,are there any ms access templates to create a structured survey/questionnaire? preferably at no cost. i need the survey to be able to go to certain questions based on answers. for example
4,what do you do when your love leave you for ever?
3,how can i leave an e-mail at wwww.kingflex.tv.?
1,what is the best christmas gift for a boyfriend?
1,what kind of man are u atracted 2.? im atracted 2 boys with blue eye
6,what are my symtoms of heat waves
5,with research tools like the internet how come some poems are still anonymous? can't they trace the author?
3,how many years will young buck get for the stabbing incident?
6,how do you stop a nervous habit of biting the inside of my mouth?
5,what should the serving temp. of coffee be ??
4,why do lesbians or bi-sexuals or bi-curious females believe that women are better in bed than men? my reason for this question is to prove
7,what is the color of the bear? a bear is on top of a cliff 200 meters tall. it trips and falls down and hits the ground in 20 seconds. what is the color of the bear?
6,what store can i buy jovan ginseng?
6,what is a good over the counter medication to help me stay asleep
3,how many jackets do i have altogether? in my wardrobe all  but four of my jackets are brown
3,when did eric carr die? 2nd drummer for kiss
2,i keep getting the network cable unplugged error with windows xp!? ok. this is absolutely retarded. i have a network cable
7,fast levenberg-marquardt algorithm?
1,what is the best business idea to start with and make good money?
1,what if person w/ legal custody dont give permission for me to claim dep.even though he lived w/ me for 1 yr.?
6,how do i stop hiccups?
1,as usual disgusting kids with too much time on their hands are intruding on a logical site.? i am so tired of looking at message boards hoping to learn something and finding it filled with disgusting comments from kids and young adults with twisted minds and too much time on there hands
7,where is paupisi ?
1,how can calculation commisions in the network marketing plans or programms?
4,have u ever been friends with a member of the oposite sex 4 more than a year before you started to date? are those the kinds of relationships that end up lasting?
2,how do i keep history from saving on my yahoo search bar?
1,where can i find ecards that jump out and scare someone?
4,is it possible for the girls to get the baby at very first time if they have sex? i want to know about this.
1,if germans are the most short tempered 
7,is the sun really yellow? i wanted to know if the sun was really yellow or was that a far away look at it. is it red or orange what color is it.
7,what does germination mean? how it works?
4,how do i tell if a guy likes me or not ???
1,art gallery feasibility? what would be the major fixed and variable cost items/drivers for a small art gallery? some might seem obvious
2,what are suitable professional softwares to creat and edit xml documents?
7,who discovered electricity?
1,what exactly do guys look for in a girl?
7,how do fire act in 'zero gravity'?
6,information on amoxicillin yellow capsule 93/3109?
1,what are the best stock market sectors for 2006? what sectors of stock market are the best for 2006? drug
3,this one is a hilarious riddle? a woman shoots her husband.&#xa;then she holds him under water for over 5 minutes.&#xa;finally
1,does god exist? why?
1,is jcpennys hiring?
1,can you deduct the amount of a personal loan from your income tax if the borrower declares bankruptcy?
7,why space has exactly three dimensions and not more or less ?
1,should people stay at a job where the supervisors make you stand up for long periods  of time? do you think it's right for supervisors to make you do things like stand up at your desk or sit in a cold room just because you are not making enough bonus money like they expect?
1,what can be done legally to protect a person from a mental ill person sending them threating mail?
4,is the flirting and  sexual activities that go on between some men and women on here onsidered cheating?
3,what is gothic rock  about? who are some good gothic rock artists? i really need help on that (*_*)?
6,blood used to come out during brushing up my teeth. how can it be cured?
2,can i download bios for my computer for free?
1,why is my favorite color red?
2,why i fail every time i try to copy dvd movie although i have a good dvd writer and regesterd software? why i fail every time i try to copy dvd movie although i have a good dvd writer and regesterd software
2,why would there be a difference in content from the same site with different browsers? for example
4,the best celebrity to have sex with???
7,tell whether each sequence is arithmetic
1,how to become a rich?
5,the sophisticated andean
1,dontcha think we should be able to vote on best question? i think that would get rid of some of those outlandish questions.  how many more people can ask if they are really in love
1,after i reach level 5
1,what is --- 2 plus 2?
3,is there gonna be a grey's anatomy on january 2nd? what will it be?
3,this one is really a tough one. can you solve this one? a wise king devised a contest to see who would receive the princess hand in marriage.&#xa;the princess was put in a 50x50 foot carpeted room. each of her four suitors were put in one corner of the room with a small box to stand on. the first one to touch the princess hand would be the winner and become the new king.&#xa;the rules of the test were that the contestants could not walk over the carpet
4,i think my boyfriend is cheating on me; how do i confront him? my friend told me that she thinks my boyfriend is talking to his ex again. i don't know if it is true.
3,i asked if foofighter were satanic u guts told me no then y n the video doa does he have a upsidedown cross on
1,anyone else doing nothing tonight? just wondering if anyone else has no plans for tonight...my husband is working and i'm pregnant so i get to sit around and watch my family get drunk.
4,what would be the perfect date for you??
3,do advertising agencies let you audition for tv commercials if you're not a career actor?
6,what does stabbing pains in the prostate after ejaculation mean?
3,why is e-mail the same as a penis?
2,how i can add_bot to my counter strike 1.5 series ( computer game )?
7,how big is the moon?
1,where did the dollar go?!? three friends check into a motel for the night and the clerk tells them the bill is $30
1,how do i get an answer from yahoo.?
1,the last 5 minutes of your life... what do you have to say ????
4,what isphonography?
1,how do you change your yahoo id?
2,do you need to pay for mac os x remote desktop (client)? if so - what are some alternatives? (not vnc).?
2,got norton virus protection and can not get up dates why is that?
2,does anybody else use giganticurl.com? or is it just me?
1,how can someone open a savings account after being blocked by check systems(tm)? a relative has to use a check cashing service because of something he did over 5 years ago and now no bank will open even a savings account. is this true?
1,can i locate the address of a missing relative
3,what's the drummer of black sabbath's name? i seem to know everyone but him
3,where can you watch afroman's music videos?
1,i am trying to locate a phone number for someone living at 2521 s.w. mayacco bay
2,how do i clear my search history on yahoo?
1,if god can do do anything...can he create a doughnut so large that he could not eat it?
7,when an aeroplane is flying on a place which is facing earthquake
6,what is the best inexpensive way to rid cellulite and fatty deposits off hips and  stomach?
6,what is the normal value for resting blood sugar?
2,what's the best low-midrange ($400) workstation video card for 3d/2d graphics? i'll be using 3ds max 8 and maya 7 as well as photoshop.
6,how do you cure constipation? without having massive diarrhea.
7,if we all supposeably came from adam &amp; eve why is it that there is so many race's? shouln't we all be the 1 ?
1,what are the best new fields to look for employment???? i would love to change professions..?
2,what is the best website to go to when your bored? i'm bored...
7,why is wyoming so windy? can anyone explain why cheyenne the capital city of wyoming is so windy for most of the year? what climate or weather produces these strong winds?
2,can linux be installed when using xp os ? iam not able to install bec when i start installation it ask me to reboot and nothing happens..after reboot .according to readme a welcome screen should appear after  reboot .... what to do someone help pl
1,where do i find someone's phone number?
6,what is the best all natural cure for dry skin?
7,how much mass is earth converting to energy per unit time to generate its gravity?
1,what is your favorite holiday in the whole world? theres a guy in a red suit.
1,why are man hole covers round ?
6,what is that tiny pinhole near the top of someone's ear near the temple? i have seen this maybe 3 or 4 times
2,at level 2 in yahoo answers
5,does anyone know the month and year that sylvia browne was born? just curious to find out her astrological sign?!thanks!***julia***
5,what are the diferent mass communication theories?
1,what is the most confusing question that has not been answered yet?
6,when a girl gets her period will her breast start to get bigger? because my sisters breasts are bigger than mine and she is younger than me and she also got her period before me.
4,how do you find a womens g-spot?
3,why do people in germany like david hasselhoff so much? i am a curious person who has never understood why an american actor would be such a famous songwriter.&#xa;someone please help me figure this out! it's driving me crazy! thanks.
5,how can i find my birth number without any trouble?
1,whats the best way to get a cruise ship job?
7,what are the colors in rainbow? and in which order?
4,what should i do. must see details.? when me and my ex were together we faught a lot but i think it mainly due to my unwillingness to compromise. but i broke it off. and now here it is 4 months later and i realize that i screwed up and am still deeply in love with her. i waited 2 months to just get another lay she waited a month and is now in another relationship. with somone that she says she loves. but she also says she still loves me. and she torn equally between the two of us. the new guy goes to collage with her every day and is in a position where he can make her life a living hell if they were to break up. this is an excrusiating experiance for me as far as emotions go. i get 1 hour of sleep pre night. because i stay up thinking about her. i know there is no possible way this guy loves her more than me. but he is more finacially stable and is heading the right direction in life. wich of corse makes it that much harder. plus many other things i don't have room to type. so how can i win her back? or should i not try?
1,health insurance for small businesses?
1,do u think my love of my life come back to me?
1,where do i find a lender to buy only a piece of land?
1,how many feet are in an acre? 43
4,how to tell if a guy is digging u? i like this guy in my class and people say he likes me but i don't think he does and i don't want to look like a complete idiote by going up to him and asking him out if he doesn't like me to
2,unwanted toolbar. it takes me too club-freefind.net. i wish to remove it.? it doesn't show up it the program removal screen. my spyware detection doesn't pick it up. it also added new address' to my favorites.
1,i downloaded a report and it came out in a bunch of numbers and letters
4,what's the longest you've ever known someone and managed to remain friends?
4,should i get married?
7,what is a brockenspecter and what causes it?
3,what exactly killed river phoenix?
2,what is the different between yahoo interface in old version and lastest one? i mean that i want compairing between these in graphical user interface....using the human interaction  with these interfaces.
4,where or how do i get to the x-rated side of yahoo?
3,what is worse than biting an apple &amp; seeing a worm?
1,when did you become a pagan/wiccan ???
3,what might be the first step to becoming a gospel recording artist other than making a demo? i would especially love to sing back-up for a gospel artist.(karen clark-sheard
7,convert the following please:                 55ft/lbs to n/m &amp; 65ft/lbs to n/m &amp; 75ft/lbs to n/m  thanks?
1,who is luciano pavarotti?
7,why do magnets pull toward metal items?
1,what is infrastructure? in bpo
2,is there any site offerign free images/clipart without any copyrights?
5,how do i shot web?
5,what was lucknow pact? it's related to the history of pakistan; a part of asain subcontinent
1,which gets dirtier when you wear it
7,if atoms of a halogen nonmetal gain one electon
6,good supplement names to strengthen my muscles? i need some really good supplement names to strengthen my muscles. i exercise regularly and i want a steady growth of muscles
2,what all do i need to keep my computer safe and clean and running faster? i just started using my computer and i am new to this.i have mcafeesecurity
1,how do i access my account  balance/activity with wells fargo?
1,how many of you pray to win the lottery? i am just checking my odds. =)
3,who killed kurt kobain? himself or courtney love?
4,my boyfriend is going on a 7 day cruise w/out me. should i be worried? we have been together for 4 years and are very committed. he has never cheated on me and claims that he would never do so either. we are in love
1,is ace ventura still a classic? i tried to watch it
4,is it k to have a boy and girl friend if they no?
3,how do you stopyour mom from watching soap operas? my mom will not stop watching soap operas.
6,is frequent masturbation bad for teenagers? im 16 and ive been masturbating regularly for a long time and recently  (last 4-6 months) been doing it once sometimes twice aday is this bad? i also get verry tired sometimes can this be a possible reason?
4,why do the people have such a hard time treating person's with disabilities like real people? physical disabilities (like someone who uses a wheelchair)
2,what is java
3,in the rugrats go to paris how did chuckie's mom die?
7,what is acid?
3,do the backstreet boys have a chance on their comeback? did their little hiatus hurt their careers or can they start from scratch? i really don't care; i'm just throwing out the first thing that pops into my head.
1,how much it costs to rent 1 bed room apartment in chicago and suburb area?
3,are jennifer aniston and vince vaughn still dating or are they engaged or is it all over between them anymore?
1,what are your favorite colors?
7,does anyone know of a good college to study zoology at?
6,why are my eyes burning all of a sudden when i put in my contacts? i didnt do anything differently than i usually do. i took out my contacts the night before and cleaned them like im supposed to. when i went to put them in the next morning
2,why is it that pimple face teenagers get on the internet just to bash people? i was just wondering...some people are on here for fun and some take it seriously and some are just down right rude and obnoxious.
2,how do i get data from a hard drive that died due to a corrupted partition table? i can see the two partitions on the drive with fdisk. partition magic says the drive has a non-standard geometry. i am unable to install even dos.&#xa;any ideas how i can get data from the second (extended) partition?
1,what would you like to see in an economic programme on tv? hi
1,what is the easiest way to learn the capitols of all 50 states?
2,how do i reactivate my yahoo account ? my yahoo account darkmoongx10 has been deactivated .&#xa;i want yahoo reactivate my yahoo account darkmoongx10.&#xa;it is very importand for me please .&#xa;and i have in this account an importand information for me&#xa;i'm truth in yahoo that will reactivate or back to me my yahoo account .&#xa;&#xa;and i'm allready everyday help alot people to join to yahoo services really.&#xa;thanks too much
1,who is beautiful - men or women ?
3,what movie is this from? i seen a lot of these questions lately
2,how can i play old dos games on my windows xp?
3,what is a really cool christian song...? i need a really cool christian song that can be sung as a duet between a husband and a wife.  please help!!
1,where can i buy standard bank balance confirmation letter for auditing purpose?
6,how can you not be a hoe but still have a little fun?  help me out please?
5,where can i find a list of all us college operating budgets? particularly interested in northeast/midatlantic region
2,is there an easy way to create a program to catalog books in microsoft access?
1,how to get pass word of my yahoo id if i have forgotten details provided at the time of ragistration?
2,how can i remove temporary internet files
4,do you believe in love at first sight? i dont
1,is dance a way to give away tension and frustation?
1,need to find phone # of friend in edison new jersey?
6,what should you eat when you have high blood pressure?
6,what's the best way to fight a cold?
2,may someone send me a link which explains how to use the javscript console as a debugging tool? thanks!?
1,y will any1 want to crossdress?
1,how would you change the site; www.gadgetell.com?
7,using specific examples
1,what do u think can make a search engine better than the existing ones like yahoo
5,what can u recommend as the best cd program for learning spanish?
5,z=2011+502.75+25+04 z=2542.75/7 z=?
1,why december 21
7,what is gneiss?
2,what php/mysql powered wiki software with user account management would you choose? i have a private lexicalic project for which i want to have a moderated and user-rated participation. the wikipedia software relies too much on self-healing for this kind of project. i want different levels of access  and editing/moderation rights.&#xa;&#xa;oh yeah - open source or freeware preferred.
2,where can i sell a perfectly good 'dell inspiron 5150 laptop
1,need informaton on company known as gtec? is it a real company?
1,if you were intereviewing someone for a job
4,what should i get my wife for christmas? she is mid 30's and we have been married for 12 years and have 3 kids.  she does not wear jewlery.
4,what do i do if the 2 guys i like both asked me out on the same day who should i go with?
3,how can you listen to music with out been on the yahoo messenger?
4,what does a guy 30 years old want in a relationship?
7,what's 5 plus 5?
4,what is a good wedding gift to give to your new spouce?  she is 12 years younger than me.  suggestions?
6,if a girl says i do not want sex
3,what type of muisic is better reggeton (espanish muisic) or oder?
1,should i buy a house in nyc or in new haven ct.?
1,titanic questions? how could an iceberg hit an unsinkable ship?&#xa;why did lower classes have to wait?isn't it the crews fault for not letting them go and for almost 1
6,if with in sexual contact with a person with std how many days before symptom appears?
6,what is the psychological term or disorder
1,are vuls really a good way to avoid paying taxes on income obtained in investments? i'm considering getting into a variable universal life policy
1,how do i put the fun back in my life? i just got out of a rotten abusive relationship and i want to have fun again! it feels like he drained all the fun out of me. how do i get it back?
6,what happens when you sneeze
6,is dayquil a good medicine for the flu?? and vomiting?
4,where is the best free place on the web for a 55 year old man to find true love?
2,which of the option below is not a feature of the slt idc? 1)biometric palm scanners and proximity card readers for authorized access.&#xa;2)24*7 security and surveillance camaras for monitoring of on-site security &#xa;3)gas based fire suspension system&#xa;4)unrestricted entrance to all customers &#xa;5)on-site staff fully trained in fire suppression techniques.&#xa;   you may find the answers in: www.slt.lk
7,what dose the blotted nitrocellulose membrane contain ?
3,who is the most popular entertainer in the world?
2,calling all c/c++ programmers.? i need to store an array in a file. the array length is 1000. i want the fastest disk writing method to work. i know reading a big block from the hard disk is faster because it involves only 1 seek. i seem to have 2 optons :&#xa;&#xa;option 1) for(i=1 to 1000)&#xa;              fll&lt;&lt;array[i];&#xa;&#xa;option 2) store the array contents into a single string str and then  fll&lt;&lt;str;&#xa;&#xa;where fll is the file pointer. which would be faster. i am concerened about the performance because i need to write numericaal data in a file of size around 4 gb.&#xa;&#xa;http://cs.dal.ca/~koul/
1,when is the first day of winter?
4,i wrote 3 romantic letters and heard they was nice  would you keep doing it?
2,what are some of the sofwares that could be used instead of autocad are there any other similar?
1,what's the worlds record foot size?
5,i am doing a study for bible study and i want to know how do leviathan and king triton connected? i was studying out different things and i was informed that another name for the demon leviathan is triton.  among some other similarities.  i was thinking about the obvious triton that we all know and it struck a cord with me.  it is quite similar but it is hard to find a direct tie between leviathan and king trion in one writing.  disney is disney and there aren't too many other writings on the actual history of how this character was created.
5,why is it important to separate current liabilities from long term liabilities?
2,why do schools have stupid internet locks.?
1,what is the average monthly salary in ohio/usa?
1,what is hmo? i heard it in a movie?&#xa;&#xa;madagascar to be specific???
7,what is the mass of black holes made of?
4,how old are people when they have an orgasm for the first time?
5,phone no of medical council of uttar pradesh?
1,what will happen to gm?
4,if a man cheats on you and says he won't do it again
1,hello i do not have a credit card .i would like to have a web site to sell electronics on line can i do so ?t?
5,what do you think the saying it's all downhill from here means? some say it like it's good
4,does true love really exist? if so
1,how to torture my friends?
1,which do you prefer baby phat or apple bottoms?
2,how to keep computer from restarting when playing a game.?
4,what are a few songs that put you in the mood or keep you in the mood?
5,who came first on earth a man or a woman??????? u could win money plz help!!
1,was this x-mas day better than previous?
2,best search engine? which one is the best search engine?&#xa;&#xa;* google&#xa;* yahoo&#xa;* msn&#xa;* ask jeeve
7,do you know a name of a male haitian mathematician?
7,what is a baby seal called?
1,what shape do you like to see most? you can answer square
3,tu pac or notorious b.i.g.?
2,my mpeg files do not burn on sony 52x cd writer so is with others. it's a recent problem. tell me tne cause. i have sony 52x cd writer installed and use windows 98 on pentium 3. previously it used to work properly with cds and cdrs. but suddenly it is no longer working properly. my burning processes fail as i receive frequent error messages. specially with mpg files and also with data files. i am using nero 6 bundled version and tried winon cd power edition 5
1,if you could be a teacher
1,what is the web address to look up registered sex offenders in your community or state?
6,what medication is used in treating hepatitis c infection? can one survive with hiv and hepatitis c infection without chemotherapy?
5,where is handwritingwizard/com?
1,information on genealogy on john e tozer?
3,what is the relationship between 50 cents and jarule?
2,any good linux distro  ? it should be a live cd
2,how many designers are supported by visual studio team system architect edition?
2,meta tags? is there somewhere on the web that can explain meta tags and how to put them in your header so you get more hits to your website?  we used frontpage to build the website.  can we just cut n' paste code into header?  help!
5,where on the net can i find step by step instructions on toothpick bridge building?
