Category,Text
3,which type of manga do u prefer - shonen manga or shojo manga? shonen means guy's manga and shojo means girl's manga
5,what is titratable acidity
4,love and romance?
2,google answers or yahoo answers? what service do you prefer most?  &#xa;google answers or yahoo answers?
2,what is the best tutorial for adobe after effects?
1,do you support chinese characters here?
1,what's the difference between motivation and inspiration?
3,is the movie 'rent' that recently came out too mature for kids 12 and under? please dont just say its rated pg-13. wuts ur opinion?
4,how do u feel wen ur inlove?
4,i have been teasing this girl and she says she likes it but says that i am mean and wont let me go further ??? i need to know what 2 do
4,what is the best way to get your girlfriend to have a threesome?
4,why is rose red?
5,what year did the stock market crash? that caused the so called great depression
7,submerged geometric shapes near cuba? these were discovered in the summer of 2004 (i think that was when).  the finders thought they were probably buildings
2,when yahoo and msn talk to each other...which one will u use? and why? and give reason...if i can't decide the best answer i'll call a vote..and that's likely to happen
2,why did my font size change on all internet pages including yahoo?
2,why did yahoo start this question and answer site?
4,wat if ur inlove with a guy but afraid to tell him wat u feel..wat i'll do???
1,im looking for the title or artist that sings this song.? it starts as i cant believe i believed everything we had would last
2,what is the difference between blog and xanga?
2,i need help on how to put flash videos on ur page
1,what's the meaning or significance of a rainbow?
1,what's the best accounting program to buy for my small business?
6,what causes back and chest pain in teen? i'm a teen and experienced severe back and chest pain that seemed to move in location in response to physical movement.  it was extremely painful and hard to breath
1,have you ever listened to the dark side of the moon with wizard of oz?
1,how can i find the guy with sohamnikname in this site? i think i have the same opinions in many questions
2,i have 2 computers on a network
6,i need an energy boost...natural ingredients preferred...home remedies welcome? i'm 33 yrs old and i feel that my energy level is low.&#xa;i have 4 kids i should feel like one
6,how many people do you know that died from smoking ?(not side effects of smoking but from smoking)?
1,what is a kpod chicken? i do know that this chicken is a male chicken and i was toldthat it had testicles under their wings
5,what is the crime rate of mojave high school in las vegas nevada?
1,who has 600points?
5,in what ways does wildlife extinction impacts our world.?
1,where there american snipers in the 101st airborne during world war 2 ?
1,how do they keep dogs who detect drugs not addicted to drugs?
1,when a paid delinquency on your credit report reaches the end of it's five years
1,why do ppl ask about sex?
1,what did you get for christmas?
3,favorite songs by the beatles? list your 10 favorite songs by the beatles
7,application of matrices in economics?
2,why every time password field shows either solid big dot (.) or asterisk (*) why not other characters?
5,is there a loan company that will loan me money
1,will you help me find a picture of mayor adam west
4,how do i know if a guy likes me more than a friend? i met this guy and he is really kind and sweet. he gives me rides back to my house
1,who is the fatest person in the world? who
3,why do singers with accents dont sing with accents?
6,what are some medical reasons for not being able to fly?
2,how do i look at someone's yahoo profile and pics?
6,*help* i just got a sore throat last night and i have a choir concert on monday...? *help*? is there any way i can easily get rid of it? maybe like a household remidy!?! *help*
2,how can i close y yahoo account?
5,can anyone tell me how a tablet(medicine) works?
4,why do some girlfriends like to have sex alot and some dont? i had a girl friend that love to have sex. now i have a girl friend that dose it 2 if im lucky 3 times a month whats up with that?
1,where can i find info on a fatal accident that killed my best friend online? her name was lois fern ramey tolliver... she was 6 weeks pregnant and was killed on the aa highway in carter county kentucky after striking a 2005 freightliner in the wrong lane in her blk 2005 merc cougar
4,what is the average number sex per month for a marrid cupple?
2,can you include somebody else's rss feed on your webpage?
3,what do you think of john lennon?
2,i dont understand smtp (iis) xp?? pleeeeaase?&#xa;i want details?
2,starting with a circle
6,are there any side effects to the product airborne??
4,why do people cheat on each other? is really human nature not meant to be with one person?
6,what causes eye stys ? i have a big red sty on my upper lid . it's very painful . what causes it . it came so sudden .
3,is quintin costa the carver? well
3,where can i get the words to the song  on the 12 days of christmas?
1,do you go to public of private school? dont tell me what school you go to.?
7,does our sense of taste change as we age? children tend to dislike bitter tastes
7,what is a cubit?
1,how do you get rid of a boyfriend who just does not get you do not want him anymore??
3,who would win in a no weapon street fight? jet li or 50 cent?
4,how do you delete topics from your history?
4,i want her soooo bad!!!! i can't stop thinking about her constantly!!!!? what can i do? i can't get this girl out of my mind! obsession is nothing
6,would wearing ankle weights all day make your legs slimmer or bulk them up?
1,what is the best way to clean you credit.?
3,do you like nudity in movies? some movies throw it in just so people go to see it
1,is their a free crimnal back groud web site?
1,recently
2,i am selling a computer
6,can you be sued for making homemade salve? i am thinking about making homemade salve and selling on line and at various craft shows. can i be sued??
2,what is the website that list the job market in asian country?
1,is my membership paid up? i cannot find my aarp card
5,who were the first users of the zipper?
5,are there any colleges offering lifespan a psychology course during the winter break in the newyork area?
1,do you tip waiters in australia?
5,what is the best part time mba program in atlanta
4,if you like someone and your not sure they will like you back what shall you do?
1,hospital t.v.s?? if scientist say that telivision is so bad for you...then why is there one in every hospital room?
4,i would like to know where to find the good adult chat rooms.?
1,did jesus really die on the cross?
3,did annette benning receive an oscar for her role in being julia?  what website has this information?
6,cavernous hemaniomas( around/inside right ear
2,what is the process deskpan.dll? is it safe to be removed from my computer and what exactly is it (spyware)?
3,whats this rock song? the chorus is sung in a britishy accent although i think the band is american and the lyrics go it's all over
4,please help me !? what should i do i wanna ask a girl out but i think shes got something going on with a friend.
6,what is a s-curl?
1,does anybody know how to astral project? (controled out of body experience)? can anybody tell me the procedures for a full
2,what is the best free photo hosting service?
1,what is the real name of pope john paul(ii)?
3,do you think eminem is the best rapper ever???? well emienm...i believe you em to the core....the most &#xa;popular rapper even in india
1,how can the weather be hot as hell one day and cold as hell another?
1,should a professional gambler who file income tax as a gambler
1,when you create a group are people able to access it without you inviting them?
3,who are the composers of garota de ipanema? when was it composed?
6,what is posterior fossa syndrome?
1,how can i find my baby's photo from the hospital in 2002?
1,what's the best way to put together a difficult clue/scavenger hunt in portland/vancouver? i'm doing a clue to clue hunt for my husband's birthday... any ideas?
1,where in florida is a house made of coral and built by a 4 ' man? i saw this on tv a month ago
3,which singer(s) performs missing (like the desert misses the rain)?
6,what's the fastest way to loose belly fat?
3,anyone remeber the movie solient green? if so
2,how do i install front usb 2.0 ports?
2,how to deploy software to every computer apart of a domain? i need to deploy software to 300 computers  thats part of a network
7,one purpose of the collision experiments is to study blank structure?
7,why does a kitchen gas burner glow yellow when a pot of boiling water overflows?
1,where can i cash a cheque from great britain in pounds in the usa? i will be receiving a cheque for a large amount from a lotto winning that will be for 1
2,i want to send a friend an album i put together online.  is there a place that allows me to send a 80mb file? i would like to just be able to log on and upload and send.  i've seen my friend pull albums off a site that her brother had sent her but i can't remember the name.  not bit torrent.
7,arteial supply of the heart?
4,what is the best way to get your ex wife to leave you alone? we have been divorced for 2 years and i am re-married and i have custody of our 2 girls but she will not stop the calls
6,how long does it take for the hiv to appear positive after someone gets infected with it?
1,what's the best type of mortgage to refinance to? should we stick to a 30 year fixed
2,how to permote a site at zero cost?? i have built a site http://cooltechno.250free.com and wana permote it what to do??
6,how addictive is extacy? can you have a ''bad trip'' on extacy?
1,what's the world's biggest town? i mean
4,is it wrong to have an affair after marriage? i am not happy with my husband so if i have affair with somebody does it amount to infidility?&#xa;i have a daughter so i don't want to break my marriage.
1,where is the best place to get lost in the wilderness and survive in north america?
4,where do you go to makeout if you have no car and can't be alone at home? yeah..... movies seem to work ok
6,what causes bad breath and how do you get rid of it?
5,are university of pennsylvania and new york university public or private universities?
7,do insects breathe?
5,how many licks does it take to get to center of a tootsie roll pop?
3,who wrote frankie and johnny?
2,what is the maximum bandwidht does the slt dsl support at present? about slt telecommunication in srilanks.
3,when does kingdom hearts 2 come out in the u.s.?
3,if you saw pride &amp; prejudice tell me what you thought of it? i saw the movie and i loved it!
1,is patriarchy inevitable?
2,is there any real difference between friendster and myspace?
3,does anybody remember the old comedy show called the goodies? i remember it was on pbs back in the 70's.&#xa;&#xa;the lyrics for the theme went something like this:&#xa;the goodieeeeeees&#xa;goodie
2,why does firefox loose file extensions when i try to download a file. eg. 123.xls is saved as 123 only. no.xls i know it has to do with the way the software handles mime types
2,how to make a backup of your windows registry.?
1,what is intrisic value?
4,how do i find my soul mate?
4,how do i know if he is the right guy for me?
1,why don't president bush do something effective to keep illegal aliens out of the country?
1,what could be the internal control weaknesses in relation to purchases and accouts payables?
5,where can i see an aerial shot of an address?
5,what are 4 ways seeds travel? i am doing a project on how seeds travel! can you help me?
1,bail bonds boise idaho licence? want to get a bail bondsman licence for boise
4,is having sex with a third cousin who everyone refers to as momma a bad thing?
1,how do you legally change your name to a 'symbol' like prince did?
3,is anybody goin to see the new version of king kong?
7,what is the chemical name of  bermacoll used in paint production?
1,jungle mein mor naacha kisne dekha???
3,how can i meet jonathan schech
2,how does the mapquest directions feature work? who created it
1,why cant i find a decent job? i'm educated
5,instead of exluding discussions of evolution/creationism/intelligent design
6,what is pubic hair for?
1,wireless router worth the $$?
4,i have aboy friend and another girl wants me. how do i stop the girl?(read details)? ok
1,how would u rate bowwow?????
2,so where is it in domain ?? here's the answer that ociphoto gave:&#xa;you can set it in a domain policy. if you edit the default policy for the domain it will be set for all users once they log in.(i know that but where i can find it??i found where i can hubit users to change homepage just that!!!!!
6,has anyone had bells palsy...if so..how long til first noticed any recovery/improvement. thanks s?
4,i'm in the 8th grade and there is a girl i like. what should i do.?
1,church info? what is happenen in your church
1,do jimi hendrix and cream lead to development of heavy metal music?
1,how do i delete search words?
4,i asked my crush to the winter dance and she said yes so now everytime were together..i want to be more..? she started out as my firne during softball season and we hung out messed around we were kewl i asked her out once during softball but she got a lilweird and went back to her girl..so then we were just friends and then we started to hang out more and so i asked her to the winter dance(jan.13) so everytime we see each other out in publice we glance smile and and wink or laugh it depends but when were not together were on the phone talkin about everything thats anything and when we happen to run into eachother but were with different ppl we always glance back and smile and keep looking everyonce in awhile..i want us to be more  but i jut dont what to tell her..
7,natural gas composition? there was a gas leak in the building at work today.  the plumber
6,does anyone know what it is when you have constipation with flu-like symptoms?
1,what is the meaning of corporate training?
1,how to be like a yahoo founder mr. david filo??
5,what is a nice gift for my sister? she is 32 has two boys and she is studying to be a minister
1,where can i purchase happy new year cards to send out to friends and family? i want to be different this year with sending new year cards instead of the happy holiday cards.  any ideas?
6,he has a reoccuring single blister on his penis that comes once a yr from stress. what is it? could it be venereal?  it never causes any pain and it is only one that he has had come and go for years.  is it something to be concerned about?
2,how do i use css to put an image at the top-right of a page?
2,what is the best free ocr software for windows? no trialware please!
3,what is your opinion on how well or badly the latest installment of harry potter went?  why?
2,does anyone know of an opensource web registration software that i can use with php and apache?
6,what is the difference between foam soap and regular liquid soap? is one better than the other? or are they virtually the same.
1,what kind of toys do you recconnend for 10years boy? ^^
1,the thing says no spam how do u know whats counted as spam?
4,there is a guy that i met in school but i donot like him like he like me what should i do? the reason that i donot like him is he say things that i dont like i try to be his girl but he do not have a car to take me out than one day he say i want to get you pregnant but if he would have say i wish thatyou was here with me that would have been diffect thenif i say something that he donot like he be like i went to kill my self the only thing that he show me is that he can pay my phone bill. what should i do
1,how do i find what city a phone number is coming from?
4,will i always be alone and single? it just seems hopeless for me
1,what is the capital mexico?
7,is the big bang theory probable
4,how different is the feling of penetration between a man and a woman?
2,can any one know about microsoft excel ? i want to protect my xl file from others delete it.i know that i can protect by editing and see from others.but i dont know how to protect ot by delete from others?
1,if you were 15 wat would you get your 15 year old best friend for christmas?? just to let you no
7,why sometimes a white foggy line or trail made behind the airplane in the sky.?
1,how can i reduce the size of a picture? with what program?
7,does insulated or uninsulated wire work best for electromagnets?
7,how can i make a phone call to argentina? besides the local phone number
6,i was raped when i was 5 years old. no-one knows about it. i dont remember bleeding. am i still a virgin? will i bleed the first time i have sex as an adult?
1,do women really find men in uniform attractive? i was just wondering if it is the army uniform getting me all the looks.
1,pop ups that i want are now being blocked
1,what is the hottest state in the united states?
2,can some one tell about some free website hosting sites??
1,i'm getting problems sending mail from my yahoo what do i need to do?
4,i like exexex bf we kept breaking upthen gettingtogether he has a gfnow and i c him everydayin skooli like him i like exexex bf we kept breaking up then getting together he has a gf now and i c him everyday in skool and we have all the same classes but i stil i like him alot i cant stop thinking abouty him...what do i do????i want to get over him but it hard cus i see him everyday and i still have feeling for him..please help????
2,how can i connect wireless w/ speedstream adsl modem and belkin router?
7,which igneous rock can be changed into schist?
3,what is the best electronic out?
4,i hate my best friend's boyfriend!  what should i do? what really stinks is that she's changed.  she never hangs out and he always causes drama when she does.  should i just find a new friend?  i want her to be happy
7,why is uranus out of place? was there a cosmic collision?
7,can anyone tell me how the snow is formed? because we have rain
4,how much do you love your pet
1,what do you think is the creepiest job?
2,how do i delete username and password
4,i live with my parents
2,what happened to the solitaire.com site. the download is no longer working.?
5,what is meaning of shivani?
6,i have mucus in the back of my throat how can i get rid of it?
6,my wife has a menstrual cycle 4 times a month for about 7 days.what is the problem?
1,how do u make alot of money when your a kid?
1,should gov. schwarzenegger stay the execution of stan tookie williams?
2,ditch firefox for internet explorer 7 [beta]? i've been a fan of firefox for quite sometime now &amp; decided to check out the ie7 [beta].&#xa;to my surprise
1,is there anybody to post me free coins of his country?
3,where can we find vintage carnatic music videos to download free?
6,how many times is go toget upset during a day? why i am getting upset?&#xa;why i can not save money although i am working?&#xa;why i always feel lonly?
1,how to find out if someone send you money from western union?
4,can you help me? i am having trouble making friends! i'm from a small town!? hi!&#xa;   i am from a small town and now have moved into a lage town! i am married and we have a 2 year old son. we go to play groups but
5,should punctuation marks always be inside parantheses?
6,how many mg of vitamin c should be taken per day for an adult to fight the common cold.  can you take to much?
3,what do you get when you multiply six times nine? and why does it matter?&#xa;&#xa;(and
6,what is the quickest and safest way to loose weight? (no fad diets)?
1,what would u do for a clondike barr?
6,how can i lose weight at home? well iam 18 and i have no money to be wasting on a product that might not work so iam lookin for a free trail of some weight loss pills can you help me
1,what is the difference between an agreement and a contract?
1,how to change a habit ?
1,what do scientologyist believe in ?
6,is there anything out there that lightens freckles? are there any creams or alternatives to lasers or surgery for lightening freckles?
3,in the last hour yahoo decided it's not ok to refer to gary&amp;wendy as retard's but jeff the drunk is fine????
3,tru calling? does anyone know why tru calling on fox was cancelled?
6,side effects of protonix 40mg? what are side effects?&#xa;&#xa;same for aciphex 20mg
1,how do you sell a house that is listed jointly...the parties are getting divorced.?
2,what site can i go to to find smarze
7,why does a laser shined on brushed alumiun reflect a solid halo
6,what is a good natural way to lower blood pressure?
2,how do i incorporate a music video into my web page? what code do i use?
1,are there child molsters in ct?
5,before they invented drawing boards
3,how can i unblock myspace? my school blocked it
2,which is the best programming language till date?
2,how do i run a ruby program on winxp (i have ruby installed...)? i have intsalled ruby but can not figur eout ho wto run a small program. windows xp...
1,how many times has christman fell on sun. and what years?
7,why do people need sleep? we've always accepted it as a fact of life
1,virtual administrative assistant/answering service? has anyone worked with a virtual assistant? would you pay for the service? i am thinking of starting this serv&#xa;a virtual admin. i am thinking of starting a small business as an virtual admin. asst. setting up  video-conferences for different companies using my software and camera. as well as projects that any admin. asst. would do. i have worked with polycom
6,is general surgery worth it?
1,can you give me a job? non profit professional
2,whay my computer take too much time during the boot process
3,what is the best music blog to read? i like stereogum
2,i need the software for a lexmark z611 printer where can i go to get this and download it? bought the printer used.
6,what is obsessive compulsive disorder?
1,what is the genesis of the name 401k?
4,how can i increase the volume of my sperm when i orgasm?
4,what is orgasam?
2,what happend to odigo messenger?
2,can someone help me get gmail?
4,i have a husband and im paying 95% of the bill should i dump him?
3,does anybody know the group that sings staring down the barrel of a 45? swimming through the ashes of another life
6,can you get a wart from touching someone's wart?
2,why isn't  the default login to yahoo! mail secure? is yahoo! collecting our passwords in clear text for some nefarious reason?  why don't they make the default login to yahoo! mail secure?  i've asked them about it after spending the better part of the day looking for a way to provide feedback to yahoo!
6,what is philtrum?
4,who is more creative with sex men or women? and if so what did u do for your partner
5,what type of heat is usually the cheapest to install and maintain:lp gas
1,how to  to deposite money in personal paypal account?  i have hdfc bank account. i live in kolkata
1,i have been offered a listing in manchester who's who. is it a legitimate publication? they don't say how they got my name and address at work.  they don't say who nominated me. and they do say they are not affiliated with other who's who publications.
3,if the foofighters arn't satanic the upsidedown cross would be against their religion?
2,can i run 2 internet servers at the same time? my club wants to have a chat room on aol for meetings.  do i need to change from my server to aol as i want to keep my own?  or is there another way to do the chat without having aol?&#xa;thanks!
1,where is the best hook up spot?
2,how good are dell xps desktops? i don't care about price.  eta of the system is a major part
3,who is your favorite country singer?
2,turn off dsl modem at end of day?
2,what is the best software to edit pics? any and all would help. it would also help to know if it is free or not.
3,i can't remember the name of the villain who would always tie dudley doright's girlfriend to traintracks??
1,what is the best way of maintenance practice following in the world?
2,how i can install php on xp?
4,what is the best christmas gift for an 18 y/o girl from tx. who loves horses? (from a boyfriend)?
7,what is the process of cremation?
3,where can i find a site to download yu-gi-oh episodes from 190-220 in english for free please i need help!!!!? i have treid using lime wire
1,who all out there likes dogs?
7,what is the predicate logic?
3,what tv station is the best out of cbs
1,how do you download yahoo! answer beta?
2,what is sound card in computers?
4,how do i get a boy to tell how he feels about me? he likes me but he wont tell me
1,what should i do with all of the holiday cards i received?
1,how can i get money by working online? i have read so much on internet but can i believe other people who i havent met before
3,what`s your favourite singer?
1,which bank pays high cd interest ?
1,i am bored and i feel exhauseted working all day. what should i do?
1,what is faux fur?
7,is taurine really bad for you? that stuff in energy drinks.
6,does recurring cold sores mean you have herpes?
1,should i kiss my boyfriend and if i do it tomorrow would it be to fast he not like it?
1,why do men put there wallets on there right butt cheek pocket? ever though about that?
7,what are the main products of the incomplete combustion of fossil fuels?
1,how can i meet jeniffer lopez for real?
1,why do we hav dream? when i sleep i often hav dream y do we hav dream when sleeping.
3,is the daily show the best news show n tv?
3,which csi is best?
1,what is the reason for poitns on yahoo! answers? im so confused!
2,what is giftworks 2006?
6,do health insurance companies cover plastic surgeries?
4,are there any true free dating on line that do not charge a fee for there services?
1,what were the books on the best seller list in 1970 and 1976?
3,what is your favorite horror movie? whoever chooses my favorite will definantly get thumbs up
